{
  "packetId": "5f0a4c1e-9d2b-4f6a-8c3d-1e7b9a0f2c4d",
  "correlationId": "0c8b6f2a-3e5d-4a7b-9c1f-6d4e8a2b0c3e",
  "parentPacketId": "9a1d3f5b-7c2e-4d8a-b0c6-2f4e6a8c0d1b",
  "schemaVersion": "v1",
  "packetType": "event",
  "source": {
    "kind": "app",
    "id": "synthetic-app",
    "version": "0.0.0"
  },
  "createdAt": "2026-06-08T00:00:00Z",
  "governanceState": "governed",
  "authorityClass": "app",
  "deliveryMode": "durable",
  "profileId": "profile-synthetic-001",
  "payload": {
    "schemaRef": "urn:jester-intelligence:schema:v1:signal",
    "data": {
      "fixture": true
    }
  }
}
